{
  "id": "wrk_01936b2a7c4e7a1b9f3d2e8c6a5b4d20",
  "owner": "account:acc_01936b2a7c4e7a1b9f3d2e8c6a5b4d10",
  "title": "Rotate the staging database password",
  "status": "running",
  "visibility": "full",
  "lease": {
    "epoch": 1
  },
  "profile": "full",
  "created_at": "2026-09-14T07:00:00Z",
  "updated_at": "2026-09-14T11:40:00.0001Z"
}
