{
  "id": "wrk_01936b2a7c4e7a1b9f3d2e8c6a5b4d21",
  "owner": "account:acc_01936b2a7c4e7a1b9f3d2e8c6a5b4d10",
  "title": "Invoice CSV export",
  "status": "running",
  "visibility": "full",
  "lease": {
    "epoch": 1,
    "holder_run": "run-7f3a",
    "acquired_at": "2026-09-14T09:00:00Z",
    "expires_at": "2026-09-14T13:00:00Z"
  },
  "profile": "full",
  "created_at": "2026-09-14T09:00:00Z",
  "updated_at": "2026-09-14T11:40:00.0002Z"
}
